keys,en,ru,ua
gossip_portal_1,"I can open a portal to one of the Bagel Islands for you. For a fee, of course. But it's totally worth it! You'll find plenty of flavorful ingredients there.","Я могу открыть для вас портал на один из бубличных островов. За плату, конечно. Но оно того стоит! Там вы найдете множество вкусных ингредиентов.","Я можу відкрити вам портал на один з бублічних островів. За плату, звісно. Але воно того варте! Там ви знайдете багато смачних інгредієнтів."
gossip_portal_2,Are you short on cash? I'll let you go to the nearest islands on credit. I'm sure you'll pay back swiftly.,"Вам не хватает наличных? Я отправлю вас на ближайшие острова в кредит. Уверен, что вы быстро вернете деньги.","Вам не вистачає готівки? Я надішлю вас на найближчі острови в кредит. Впевнений, що ви швидко повернете гроші."
gossip_portal_3,"There are chests scattered on the islands, but the natives keep them locked. I'll unlock every chest you manage to bring back, for no extra charge.","На островах разбросаны сундуки, но аборигены держат их запертыми. Я открою каждый сундук, который вам удастся вернуть, без дополнительной оплаты.","На островах розкидані скрині, але аборигени тримають їх замкненими. Я відкрию кожну скриню, яку вам вдасться повернути, без додаткової оплати."
gossip_portal_4,"Yeah, these portals are two-way. But the portal will close once you return, so make sure to grab as much loot as possible.","Да, эти порталы двусторонние. Но портал закроется, как только вы вернетесь, поэтому постарайтесь собрать как можно больше добычи.","Так, ці портали двосторонні. Але портал закриється, як тільки ви повернетеся, тому намагайтеся зібрати якнайбільше здобичі."
gossip_portal_5,"You don't have to return once your pockets are full. You can throw chests into the portal, and I'll keep an eye on them... For a fee.","Вам не нужно возвращаться, сразу когда ваши карманы будут наполнены. Можете кидать сундуки в портал, а я буду за ними присматривать... Не бесплатно.","Вам не потрібно повертатися, коли ваші кишені будуть наповнені. Можете кидати скрині в портал, а я за ними доглядатиму... Не безкоштовно."